{
  "schema_version": "1.0",
  "namespace": "synthetic:civic",
  "id": "act-specific-final",
  "version": "1.0",
  "schema": {
    "namespace": "matter",
    "id": "civic-profile",
    "version": "1.0",
    "digest": "e8a52b868f71f2948f3ef7f9ef8d7c8cc421a5f2817193947c2c1c582a3a957b"
  },
  "common_profile": {
    "namespace": "synthetic",
    "id": "civic-base",
    "version": "1.0",
    "digest": "b4e23fd947dfd27b5932f1d1dc6945e8795af6f8cca9121156ebca43bfeb90f8"
  },
  "producer": {
    "namespace": "synthetic",
    "id": "contract-examples",
    "version": "1.0",
    "digest": "dbf7c2936f51b6c07461eb290a46e7a8cd7723234b29869dfd64893919a4293d"
  },
  "producer_code_sha256": "dbf7c2936f51b6c07461eb290a46e7a8cd7723234b29869dfd64893919a4293d",
  "scope_id": "synthetic:civic",
  "applies": {
    "jurisdiction": "synthetic:region",
    "body": "synthetic:board",
    "category": "synthetic:school-policy",
    "act": "synthetic:adopt"
  },
  "effective": {
    "start": {
      "state": "known",
      "value": "2026-01-01T00:00:00Z",
      "precision": "second"
    },
    "end": {
      "state": "unknown",
      "reason": "not_applicable"
    },
    "bounds": "closed_open"
  },
  "available_at": {
    "state": "known",
    "value": "2026-01-01T00:00:00Z",
    "precision": "second"
  },
  "source_stages": [
    "synthetic:recommendation",
    "synthetic:reported-final"
  ],
  "parents": [],
  "assertions": [
    {
      "id": "power",
      "selector": {
        "jurisdiction": "synthetic:region",
        "body": "synthetic:board",
        "category": "synthetic:school-policy",
        "act": "synthetic:adopt"
      },
      "capability": "synthetic:final-adoption",
      "allowed": true,
      "effective": {
        "start": {
          "state": "known",
          "value": "2026-01-01T00:00:00Z",
          "precision": "second"
        },
        "end": {
          "state": "unknown",
          "reason": "not_applicable"
        },
        "bounds": "closed_open"
      },
      "disposition": "unreviewed",
      "sources": [
        {
          "reference": {
            "scope_id": "synthetic:civic",
            "namespace": "synthetic:sources",
            "record_type": "observation",
            "id": "authority-source",
            "digest": "aaaaaaaaaaaaaaaaaaaaaaaaaaaaaaaaaaaaaaaaaaaaaaaaaaaaaaaaaaaaaaaa"
          },
          "sha256": "aaaaaaaaaaaaaaaaaaaaaaaaaaaaaaaaaaaaaaaaaaaaaaaaaaaaaaaaaaaaaaaa"
        }
      ],
      "attestation": null,
      "overrides": []
    }
  ]
}
